{
  "campaign_sha256": "01a97f00185f1c2b325ec2734c7bae05e1a47910e49383673707c2a95354bacc",
  "execution": {
    "live_provider_measurement": true,
    "pair_execution_order": [
      [
        "qwen-jev-control",
        "qwen-frontier-control"
      ]
    ],
    "phase_allocation": {
      "experiment": 0,
      "holdout": 1,
      "shadow": 0
    },
    "records": [
      {
        "attestation": {
          "authenticated": true,
          "decision_authenticated": true,
          "decision_model": "jev-latest",
          "decision_provider": "typesafe",
          "decision_request_id": "request-set:sha256:942654eb67e528811d1a2d88c5d6e7c8648f07693bc4f0bfb597ebd65146301b",
          "decision_request_ids": [
            "req_01a0dce7cb3578a2bbef5f26ac94ada5",
            "req_01a0dce7cc5473d2b9e97861d5d84a43",
            "req_01a0dce7fe6b734eb395a64fed8c0490",
            "req_01a0dce7ffa37bf9bef65b9786ddc783",
            "req_01a0dce828d574e38b24b3e5097ee642",
            "req_01a0dce84b117ab683de62f650d4c0f5",
            "req_01a0dce84dac7e75af365e6c4268e148",
            "req_01a0dce84ede7e00af7180fbc5b9fcd6"
          ],
          "decision_transport_security": "https",
          "evidence_origin": "live-provider",
          "model": "qwen-3.8-max-thinking",
          "provider": "dialagram",
          "provider_request_id": "request-set:sha256:1d8005331862ae1f13845373bf0ccad1d62fdfa80782d26c12a685e8c785a5d3",
          "provider_request_ids": [
            "chatcmpl-f511b0423be14aaa846543f73cffeceb",
            "chatcmpl-b6c87d634a2749208c522175c874f4cb",
            "chatcmpl-f9b12e3a27d34dee99434eb656613ea5",
            "chatcmpl-170e7a382129409194080eafb6a68f59"
          ],
          "transport_security": "https"
        },
        "audit_path": "evidence\\qwen-jev-control\\clamp.r1.audit.jsonl",
        "baseline_verification_exit_code": 127,
        "benchmark": "v216-authenticated-lineage-proof",
        "case_id": "clamp",
        "condition": "qwen-jev-control",
        "decision_authenticated": true,
        "decision_backend": "typesafe",
        "decision_model": "jev-latest",
        "decision_provider": "typesafe",
        "decision_request_ids": [
          "req_01a0dce7cb3578a2bbef5f26ac94ada5",
          "req_01a0dce7cc5473d2b9e97861d5d84a43",
          "req_01a0dce7fe6b734eb395a64fed8c0490",
          "req_01a0dce7ffa37bf9bef65b9786ddc783",
          "req_01a0dce828d574e38b24b3e5097ee642",
          "req_01a0dce84b117ab683de62f650d4c0f5",
          "req_01a0dce84dac7e75af365e6c4268e148",
          "req_01a0dce84ede7e00af7180fbc5b9fcd6"
        ],
        "decision_transport_security": "https",
        "metrics": {
          "completion_claims": 0,
          "control_plane_token_tax": 0.38246032337381713,
          "decision_calls": 8,
          "decision_input_tokens": 4788,
          "decision_latency_ms": 2518.240699893795,
          "decision_output_tokens": 345,
          "false_completion_claims": 0,
          "proof_active_claims": 0,
          "proof_claims": 0,
          "proof_revoked_claims": 0,
          "proof_stale_claims": 0,
          "provider_cached_input_tokens": 0,
          "provider_calls": 4,
          "provider_input_tokens": 7348,
          "provider_latency_ms": 29417.819099966437,
          "provider_output_tokens": 940,
          "provider_request_count": 4,
          "tool_calls": 6,
          "verification_latency_ms": 0.0,
          "verifier_runs": 0,
          "wall_time_ms": 34064.70650003757
        },
        "model": "qwen-3.8-max-thinking",
        "model_alias": "qwen-3.8-max-thinking",
        "pair_execution_order": 1,
        "payload_sha256": "a970178c9fc49afcf766672503e7c909a14cdd57b3cb1bcb15c506cf854061c1",
        "phase": "holdout",
        "provider": "dialagram",
        "provider_authenticated": true,
        "provider_request_ids": [
          "chatcmpl-f511b0423be14aaa846543f73cffeceb",
          "chatcmpl-b6c87d634a2749208c522175c874f4cb",
          "chatcmpl-f9b12e3a27d34dee99434eb656613ea5",
          "chatcmpl-170e7a382129409194080eafb6a68f59"
        ],
        "randomized_order_index": 0,
        "repeat": 1,
        "status": "max_turns",
        "timestamp_utc": "2026-09-26T08:50:01.837534+00:00",
        "trace_id": "91a174b34bc445b894b861b2fdd7aac8",
        "transport_security": "https",
        "turns": 4,
        "verification_exit_code": null
      },
      {
        "attestation": {
          "authenticated": true,
          "decision_authenticated": true,
          "decision_model": "qwen-3.8-max-thinking",
          "decision_provider": "dialagram",
          "decision_request_id": "request-set:sha256:f0ba5f73b61bbc4e2cbbf1a2e46a622e3069e5d853abb48cf63516202ff806fb",
          "decision_request_ids": [
            "chatcmpl-e21db2024f9b46c4a962c6c79731e3e0",
            "chatcmpl-9c8ac04ed64142e6a19dd6a9190d1bb4",
            "chatcmpl-81c86e676ca0486c9979bd5f70f53f36",
            "chatcmpl-684d920c9770428cb80f2b5d6e2ae040",
            "chatcmpl-6acc1be5bfa54bb087a54e81d60f19b1",
            "chatcmpl-142f54ccb8ae409ba268e3aa99cd51e4"
          ],
          "decision_transport_security": "https",
          "evidence_origin": "live-provider",
          "model": "qwen-3.8-max-thinking",
          "provider": "dialagram",
          "provider_request_id": "request-set:sha256:86d9952997edc0a855de75eb0063848ad0bd65dc9e1de472070665c416177e6c",
          "provider_request_ids": [
            "chatcmpl-52af9c5271244d1eaaa7928392cf521e",
            "chatcmpl-b39830d6c6aa4fd5b217e1b49b79f999",
            "chatcmpl-88fba2ee0ecc4696a087f6ddc829b107"
          ],
          "transport_security": "https"
        },
        "audit_path": "evidence\\qwen-frontier-control\\clamp.r1.audit.jsonl",
        "baseline_verification_exit_code": 127,
        "benchmark": "v216-authenticated-lineage-proof",
        "case_id": "clamp",
        "condition": "qwen-frontier-control",
        "decision_authenticated": true,
        "decision_backend": "openai_compatible",
        "decision_model": "qwen-3.8-max-thinking",
        "decision_provider": "dialagram",
        "decision_request_ids": [
          "chatcmpl-e21db2024f9b46c4a962c6c79731e3e0",
          "chatcmpl-9c8ac04ed64142e6a19dd6a9190d1bb4",
          "chatcmpl-81c86e676ca0486c9979bd5f70f53f36",
          "chatcmpl-684d920c9770428cb80f2b5d6e2ae040",
          "chatcmpl-6acc1be5bfa54bb087a54e81d60f19b1",
          "chatcmpl-142f54ccb8ae409ba268e3aa99cd51e4"
        ],
        "decision_transport_security": "https",
        "metrics": {
          "completion_claims": 1,
          "control_plane_token_tax": 0.6457596625100813,
          "decision_calls": 6,
          "decision_input_tokens": 6834,
          "decision_latency_ms": 108871.95129995234,
          "decision_output_tokens": 3575,
          "false_completion_claims": 1,
          "proof_active_claims": 1,
          "proof_claims": 1,
          "proof_revoked_claims": 0,
          "proof_stale_claims": 0,
          "provider_cached_input_tokens": 0,
          "provider_calls": 4,
          "provider_input_tokens": 4872,
          "provider_latency_ms": 448585.61710000504,
          "provider_output_tokens": 838,
          "provider_request_count": 3,
          "tool_calls": 3,
          "verification_latency_ms": 153.73909997288138,
          "verifier_runs": 1,
          "wall_time_ms": 557657.8141999198
        },
        "model": "qwen-3.8-max-thinking",
        "model_alias": "qwen-3.8-max-thinking",
        "pair_execution_order": 2,
        "payload_sha256": "a970178c9fc49afcf766672503e7c909a14cdd57b3cb1bcb15c506cf854061c1",
        "phase": "holdout",
        "provider": "dialagram",
        "provider_authenticated": true,
        "provider_request_ids": [
          "chatcmpl-52af9c5271244d1eaaa7928392cf521e",
          "chatcmpl-b39830d6c6aa4fd5b217e1b49b79f999",
          "chatcmpl-88fba2ee0ecc4696a087f6ddc829b107"
        ],
        "randomized_order_index": 1,
        "repeat": 1,
        "status": "max_turns",
        "timestamp_utc": "2026-09-26T08:59:19.676422+00:00",
        "trace_id": "65994e68dd17403fa2f9f8cc41f91d0d",
        "transport_security": "https",
        "turns": 4,
        "verification_exit_code": 1
      }
    ],
    "seed": 216,
    "truth_boundary": "execution records are paired telemetry; performance promotion requires the reserved holdout evaluator and does not grant execution authority",
    "version": 1
  },
  "live_provider_measurement": true,
  "signed_executions": [
    {
      "algorithm": "Ed25519",
      "key_id": "jev-v215-runner",
      "payload": {
        "campaign_sha256": "01a97f00185f1c2b325ec2734c7bae05e1a47910e49383673707c2a95354bacc",
        "case_id": "clamp",
        "condition": "qwen-jev-control",
        "decision_authenticated": true,
        "decision_model": "jev-latest",
        "decision_provider": "typesafe",
        "decision_request_count": 8,
        "decision_request_id": "request-set:sha256:942654eb67e528811d1a2d88c5d6e7c8648f07693bc4f0bfb597ebd65146301b",
        "decision_request_ids_sha256": "942654eb67e528811d1a2d88c5d6e7c8648f07693bc4f0bfb597ebd65146301b",
        "decision_transport_security": "https",
        "evidence_origin": "live-provider",
        "metrics_sha256": "b63a4b3e6b9ae927f8bb685a8c486c4b4f7fb2111369b1cd552cdebb8373ae90",
        "model": "qwen-3.8-max-thinking",
        "pair_execution_order": 1,
        "payload_sha256": "a970178c9fc49afcf766672503e7c909a14cdd57b3cb1bcb15c506cf854061c1",
        "provider": "dialagram",
        "provider_authenticated": true,
        "provider_request_count": 4,
        "provider_request_id": "request-set:sha256:1d8005331862ae1f13845373bf0ccad1d62fdfa80782d26c12a685e8c785a5d3",
        "provider_request_ids_sha256": "1d8005331862ae1f13845373bf0ccad1d62fdfa80782d26c12a685e8c785a5d3",
        "receipt_version": 3,
        "repeat": 1,
        "signer_key_id": "jev-v215-runner",